id,number,name,category,height_in,weight_kg,price,status,photos,grade,blurb,story
piece-01,1,Grand Calcite Cathedral,Cathedrals,20.5,,640,Available,images/amethyst-01.jpg|images/amethyst-02.jpg|images/amethyst-03.jpg|images/amethyst-04.jpg,8,"A towering deep-violet cathedral wrapped around a bright white calcite crystal.","The showpiece of the collection. Over twenty inches of densely packed, deep grape-violet points curve around a single luminous calcite crystal set deep in the cave. This is not a shelf accent — it is the piece a room arranges itself around. Stand it on the floor beside a fireplace, on a wide console, or in an entryway where daylight can travel into the cave and set the crystals alight. Hand-cut flat base; stands confidently on its own."
piece-02,2,Slender Spire Cathedral,Cathedrals,16.5,11.4,455,Available,images/amethyst-09.jpg,3,"A tall, graceful spire of lilac-to-violet druzy with a sculptural curved profile.","Sixteen and a half inches of elegant upward motion. The gently curved silhouette reads almost like carved sculpture, while the crystals shift from pale lilac at the edges to deep violet in the recesses — catching the eye from across a room. At 11.4 kg it has real heft and a stable cut base. Give it height to breathe on a console, mantel, or tall shelf and let it draw the eye upward."
piece-03,3,Sculptural Lilac Cathedral,Geodes,,17.4,450,Available,images/amethyst-11.jpg|images/amethyst-10.jpg,3,"A bold, wave-like lilac cathedral with a dramatic sweeping edge.","A heavyweight with attitude. Its sweeping, wave-like edge gives this lilac cathedral the presence of a piece of carved art, while pale amethyst druzy blankets a wide-open face that throws sparkle in every direction. At 17.4 kg this is a floor or wide-console centerpiece — the kind of specimen guests cross the room to touch. A confident anchor for a living room, studio, or gallery wall niche."
piece-04,4,Lilac Mantel Cathedral,Geodes,13,,300,Available,images/amethyst-05.jpg|images/amethyst-06.jpg,,"A clean, display-ready lilac cathedral finished on a polished black base.","Soft lilac crystals arch over an open cave, finished on a clean black base that makes it instantly display-ready — no stand, no fuss. At around thirteen inches it is the ideal mantel, bookshelf, or side-table statement: large enough to command attention, refined enough to live anywhere. Calcite accents glint near the base. The most effortlessly living-room-ready piece in the collection."
piece-05,5,Grape Cave Cathedral,Cathedrals,11,8.1,265,Available,images/amethyst-08.jpg,3,"Deep grape-purple points lining a generous central cave.","Rich, saturated grape-purple at its best — well-formed points crowd a deep central cave that pulls the eye straight in. At eleven inches and 8.1 kg it is an ideal bookshelf or console centerpiece: big enough to be the focal point of a shelf, light enough to move and restyle on a whim. Cut black base for confident standing. Pure color, no filler."
piece-06,6,Banded Agate Cathedral,Cathedrals,10,6.5,240,Available,images/amethyst-07.jpg,3,"A gray-banded agate rim framing a sparkling smoky-amethyst cave.","A connoisseur's piece. Concentric gray-blue agate banding frames a glittering smoky-to-amethyst interior, and the contrast does all the work. At ten inches and 6.5 kg it is a substantial desk, shelf, or nightstand companion — hefty enough to feel important in the hand, sized to sit comfortably anywhere. The quiet favorite for anyone who looks closely."
